Nicotine dependence,https://www.mayoclinic.org/diseases-conditions/nicotine-dependence/symptoms-causes/syc-20351584,https://www.mayoclinic.org/diseases-conditions/nicotine-dependence/diagnosis-treatment/drc-20351590,https://www.mayoclinic.org/diseases-conditions/nicotine-dependence/doctors-departments/ddc-20351594,"Nicotine dependence happens when your body craves nicotine and you can't stop using it. Nicotine is the chemical in smoked tobacco that causes the urge to smoke. The chemical brings on pleasant feelings, but these effects are short-lived. So you have another cigarette, cigar or pipe bowl.
The more you use smoked tobacco, the more nicotine you need to feel good. When you try to stop, you go through mental and physical changes that aren't pleasant. These are symptoms of nicotine withdrawal.
For some people, using any amount of smoked tobacco can quickly lead to nicotine dependence. But no matter how long you've used nicotine, stopping can improve your health. It isn't easy, but you can break your dependence on nicotine. There are treatment options. Ask your healthcare professional for help.","Symptoms of nicotine dependence can include the following:
You can't stop smoking.You've made one or more serious attempts to stop without long-term success.
You smoke within 30 minutes of waking up.The sooner you start smoking after waking and the more cigarettes you smoke during the day, the more dependent on nicotine you are.
You have nicotine withdrawal symptoms when you try to stop.Your attempts at stopping have caused physical and mood-related symptoms. Withdrawal symptoms can include strong cravings, anxiety, irritable mood, restlessness, trouble focusing or sleeping, depression, frustration, anger, increased hunger, and constipation.
You keep smoking despite health conditions.Even though you've developed health conditions linked to smoking, you haven't been able to stop.
You give up social activities.You may stop going to smoke-free restaurants or stop socializing with family or friends because you can't smoke in these situations.","Talk with your healthcare professional if you've tried to stop smoking but haven't been able to stop for good. Most people who smoke make many attempts to stop smoking before they're able to quit long-term.
A treatment plan that includes medicine and counseling with a tobacco treatment specialist can boost your chances of success. Ask your healthcare team for a treatment plan that works for you. Or ask where to get help with stopping smoking.","Nicotine is the chemical in tobacco that keeps you smoking tobacco. Nicotine reaches the brain within seconds of taking a puff. In the brain, nicotine increases the release of brain chemicals called neurotransmitters. These brain chemicals help control mood and behavior.
When you're using nicotine, the reward center in your brain releases a neurotransmitter called dopamine. Dopamine causes feelings of pleasure and improved mood.
The more you smoke, the more nicotine you need to feel good. Nicotine quickly becomes part of your daily routine and affects your habits and feelings.
Common situations that trigger the urge to smoke include:
Drinking coffee or taking breaks at work.
Talking on the phone.
Drinking alcohol.
Driving your car.
Spending time with friends.
To overcome your nicotine dependence, you need to become aware of your triggers and make a plan for dealing with them.","Anyone who smokes or uses other forms of tobacco is at risk of becoming dependent. Factors that influence who is likely to use tobacco include:
Age.Most people begin smoking during childhood or the teen years. The younger you are when you begin smoking, the greater the chance of nicotine dependence.
Genetics.The genes passed from parents to children may play a role in the chance of a person becoming dependent on nicotine.
Parents and peers.Children who grow up with parents who smoke are more likely to smoke. Children with friends who smoke also are more likely to try it.
Depression or anxiety.Some people who have mental health conditions such as depression and anxiety try to get relief by smoking. But smoking cigarettes doesn't help relieve symptoms of these conditions.
Substance use.People who use alcohol and illicit drugs are more likely to smoke.","Tobacco smoke has hundreds of harmful chemicals in it. At least 69 of those chemicals can cause cancer. Even ""all-natural"" or herbal cigarettes have harmful chemicals.
People who smoke cigarettes are much more likely to develop and die of certain diseases than are people who don't smoke. But smoking can cause many different health issues, including:
Lung cancer and lung disease.Smoking is the leading cause of lung cancer deaths in countries such as the United States. Smoking also causes lung diseases such as emphysema and chronic bronchitis. Smoking makes asthma worse too.
Other cancers.Smoking raises the risk of many types of cancer. Some examples include cancer of the mouth, throat, also called the pharynx, esophagus, larynx, bladder, pancreas, kidney and cervix and some types of leukemia. Overall, smoking causes 30% of all cancer deaths in the United States.
Heart and blood vessel conditions.Smoking raises the risk of dying of heart and blood vessel diseases including heart attack and stroke. If you have a heart or blood vessel disease, smoking makes it worse.
Diabetes.Smoking raises the risk of type 2 diabetes. If you have diabetes, smoking can lead to other health concerns such as kidney disease and eye conditions.
Eye conditions.Smoking can raise the risk of serious eye issues such as cataracts and loss of eyesight from macular degeneration.
Infertility.Smoking can make it harder to start a pregnancy.
Complications during pregnancy.Pregnant people who smoke have a higher risk of miscarriages and preterm deliveries. Their babies have a higher risk of having medical conditions present at birth and lower birth weights.
Cold, flu and other illnesses.People who smoke are more prone to respiratory infections such as colds, the flu and bronchitis.
Tooth and gum disease.Smoking is linked to a higher risk of gum disease and tooth loss.
Smoking also poses health risks to those around you. Partners of people who smoke have a higher risk of lung cancer and heart disease compared with people who don't live with someone who smokes. Children whose parents smoke are more likely to get bronchitis, pneumonia, ear infections and colds. And if a child has asthma, secondhand smoke can make it worse.","The best way to prevent nicotine dependence is to not start using tobacco.
The best way to keep children from smoking is to not smoke yourself. Children whose parents do not smoke or who successfully quit smoking are much less likely to take up smoking.","Your healthcare professional may ask you questions or have you fill out a questionnaire to see how dependent you are on nicotine. Knowing your degree of dependence helps your healthcare professional figure out the right treatment plan for you. The more cigarettes you smoke each day and the sooner you smoke after waking up, the more dependent you are.","Like most people who smoke, you've probably made at least one serious attempt to stop. But it's rare to stop smoking on your first attempt — especially if you try to do it without help. You're much more likely to be able to stop smoking if you use medicines and counseling. Both of these treatments work, especially if you use them together.","Social support is key to leading a stable and solid smoke-free life. Ask your family, friends and co-workers to support and encourage you. Be direct and let them know what would help you most.
Also think about trying these resources:
Support groups.Support groups offer coaching and support from others trying to quit. You can often attend at little or no cost. For example, in the United States, Nicotine Anonymous groups can be found in many locations.
Telephone counseling.Quit lines offer convenient access to trained counselors. In the U.S., call800-QUIT-NOW(800-784-8669) to connect directly to your state's quit line.
Text messaging and mobile apps.Services can send reminders and tips to your mobile phone.
Web-based programs.Sites such as BecomeAnEX provide free personalized support, interactive guides and tools, and discussion groups to help you quit.","You're likely to start by seeing your primary healthcare professional. Here's some information to help you get ready, and what to expect from your doctor.",
Mesenteric lymphadenitis,https://www.mayoclinic.org/diseases-conditions/mesenteric-lymphadenitis/symptoms-causes/syc-20353799,https://www.mayoclinic.org/diseases-conditions/mesenteric-lymphadenitis/diagnosis-treatment/drc-20353803,,"Lymphadenitis is a condition in which the small round or bean-shaped clusters of cells, called lymph nodes, become swollen and inflamed. The swelling can affect the lymph nodes in the membrane that connects the bowel to the wall around the stomach area, called the mesentery. Then the condition is called mesenteric lymphadenitis (mez-un-TER-ik lim-fad-uh-NIE-tis).
An infection in the intestines, such as a virus, is the usual cause of mesenteric lymphadenitis. Also called mesenteric adenitis, the condition mainly affects children and teens.
Mesenteric lymphadenitis can act like appendicitis or a condition in which part of the intestine slides into another part of the intestine, called intussusception. Unlike appendicitis or intussusception, mesenteric lymphadenitis usually clears up on its own.","Possible symptoms of mesenteric lymphadenitis include:
Pain in the stomach area, often on the lower right side, but the pain can be more spread out.
General tenderness of the stomach area.
Fever.
Enlarged mesenteric lymph nodes.
Depending on what's causing the condition, symptoms also might include:
Diarrhea.
Nausea and vomiting.","Pain in the stomach area is common in children and teens. So it can be hard to know when to seek medical advice.
Call a healthcare professional right away for a child who has:
Sudden, severe pain in the stomach area.
Stomach area pain with fever.
Stomach area pain with diarrhea or vomiting.
Tenderness to touch of the stomach area.
Bloody or maroon-colored stool.
Also, call a healthcare provider for a child who has pain in the stomach area that doesn't get better in a short time and who also:
Has a change in bowel habits.
Has a loss of appetite.
Is not able to sleep.","The most common cause of mesenteric lymphadenitis is a viral infection, such as gastroenteritis. Gastroenteritis is often called stomach flu. This infection causes inflammation and swelling in the lymph nodes in the thin tissue that attaches the intestine to the back of the wall around the stomach area, called mesentery.
Other causes of mesenteric lymphadenitis include bacterial infection, inflammatory bowel disease and lymphoma.","Any infection that causes inflammation and swelling in the lymph nodes in the tissue that attaches the bowel to the abdominal wall increases the risk of mesenteric lymphadenitis.
Conditions that raise the risk of mesenteric lymphadenitis include:
Viral or bacterial gastroenteritis.
Inflammatory bowel disease.
Lymphoma.",,,"Diagnosing mesenteric lymphadenitis involves taking a medical history and doing an exam. Tests might include:
Blood tests.Certain blood tests can help show if there's an infection and what type of infection it is.
Imaging studies.An ultrasound of the stomach area is often used to diagnose mesenteric lymphadenitis. ACTscan of the stomach area also might be used.","Mild cases of mesenteric lymphadenitis and those caused by a virus usually go away on their own. Full recovery can take four weeks or more.
For treatment of fever or pain, consider giving your child infants' or children's over-the-counter fever and pain medications such as acetaminophen (Tylenol, others) or ibuprofen (Advil, Motrin, others). They're safer than aspirin.
Use caution when giving aspirin to children or teenagers. Though aspirin is approved for use in children older than age 3, children and teenagers recovering from chickenpox or flu-like symptoms should never take aspirin. This is because aspirin has been linked to Reye's syndrome, a rare but potentially life-threatening condition, in such children.
Antibiotics might be prescribed for a moderate to severe bacterial infection.",,"If your child has symptoms of mesenteric lymphadenitis, make an appointment with a healthcare professional. Here's some information to help you get ready for your appointment.","For symptoms of mesenteric lymphadenitis, have your child:
Get plenty of rest.Enough rest can help your child recover.
Drink fluids.Liquids help prevent loss of body fluids, called dehydration, from fever, vomiting and diarrhea.
Apply moist heat.A warm, moist washcloth applied to the stomach area can help ease discomfort.
Eat a liquid diet in small amounts.For example, eat broth or chicken noodle soup."
Attention-deficit/hyperactivity disorder (ADHD) in children,https://www.mayoclinic.org/diseases-conditions/adhd/symptoms-causes/syc-20350889,https://www.mayoclinic.org/diseases-conditions/adhd/diagnosis-treatment/drc-20350895,https://www.mayoclinic.org/diseases-conditions/adhd/doctors-departments/ddc-20350899,"Attention-deficit/hyperactivity disorder, also called ADHD, is a long-term condition that affects millions of children. It often continues into adulthood. ADHD includes a mix of ongoing problems. These can include having a hard time paying attention, being hyperactive and being impulsive.
Children with ADHD also may have low self-esteem and troubled relationships and do poorly in school. Symptoms sometimes lessen with age. Some people never completely outgrow their ADHD symptoms but they can learn strategies to be successful.
While treatment won't cure ADHD, it can help a great deal with symptoms. Besides giving education about ADHD, treatment can involve medicines and behavior therapies. Early diagnosis and treatment can make a big difference in results.","The main features of ADHD include not paying attention and being hyperactive and impulsive. ADHD symptoms usually start before age 12. In some children, they can be seen as early as 3 years of age. ADHD symptoms can be mild, moderate or severe. Symptoms need to be seen in two or more settings, such as at home and at school. The symptoms cause problems with development and daily life and may continue into adulthood.
ADHD occurs more often in boys than in girls. Behaviors can be different in boys and girls. For example, boys may be more hyperactive and girls may tend to quietly not pay attention.
There are three types of ADHD:
Predominately inattentive.In this type, most symptoms fall under inattention. This means having trouble focusing and staying on a task. It also includes trouble getting and staying organized.
Predominately hyperactive and impulsive.In this type, most symptoms involve being hyperactive and impulsive. Hyperactive means being too active and having too much energy. It may include disruptive behavior. Being impulsive means acting without thinking ahead about the results or effects of behavior.
Combined.This type is a mix of inattentive symptoms and hyperactive and impulsive symptoms. The person meets the criteria for both predominately inattentive and predominately hyperactive and impulsive types of ADHD.","If you're concerned that your child shows signs of ADHD, see your pediatrician or family healthcare professional. Your healthcare professional can do a medical evaluation to check for other causes of your child's symptoms. Then if needed, your child may be referred to a specialist, such as a developmental-behavioral pediatrician, psychologist, psychiatrist or pediatric neurologist.","While the exact cause of ADHD is not clear, research efforts continue. Factors that may be involved in the development of ADHD include genetics, the environment or central nervous system conditions at key moments in development.","Risk factors for ADHD may include:
Having a blood relative, such as a parent or sibling, with ADHD or another mental health condition.
Being around environmental toxins such as lead, which is found mainly in paint and pipes in older buildings.
Being born to a parent who used recreational drugs, alcohol or tobacco during pregnancy.
Being born too early, also called premature birth.
Although many people seem to believe that sugar causes hyperactivity, there's no proof of this. Many issues in childhood can lead to trouble paying attention, but that's not the same as ADHD.","ADHD can make life hard for children. Children with ADHD:
Often have trouble in the classroom, which can lead to failing grades and being judged by other children and adults.
Tend to have more accidents and injuries of all kinds than do children who don't have ADHD.
Tend to have poor self-esteem.
Are more likely to have trouble interacting with and being accepted by peers and adults.
Are at higher risk of alcohol and drug misuse and other behavior that can cause problems with the law.
Have a higher risk of suicidal thoughts and suicide.
Have sleep disorders.","To help lower your child's risk of ADHD:
During pregnancy,avoid anything that could harm your baby's development before birth. For example, don't drink alcohol, use drugs or smoke cigarettes.
Protect your child from exposure to pollutants and toxins,including cigarette smoke and lead paint.
Limit screen time.Although still not proved, it may be a good idea for young children to limit TV, video games and other screen time.","In general, a diagnosis of attention-deficit/hyperactivity disorder is made if the core symptoms of ADHD start early in life — before age 12 — and create major problems at home and at school on an ongoing basis.
There's no specific test for ADHD. An evaluation can help find out whether symptoms are related to ADHD or another problem. Making a diagnosis will likely include:
A medical exam.This can help rule out other possible causes of symptoms.
Information gathering.This includes reviewing any current medical conditions, personal and family medical history, and school records.
Interviews or surveys.These may include information from family members, teachers or other people who know your child well, such as caregivers, babysitters and coaches. This information can show how your child behaves in different situations.
ADHD rating scales.These help collect and evaluate information about your child.","Standard treatments for ADHD in children include medicines, behavior therapy, counseling and education services. These treatments can lessen many of the symptoms of ADHD, but they don't cure it. Treatment also can help prevent some complications caused by ADHD. It may take some time to find what works best for your child.","Caring for a child with ADHD can be challenging for the whole family. Caregivers may be distressed by their child's behavior as well as by the way other people respond. The stress of dealing with ADHD can lead to conflict in a marriage or partnership. These problems can be made worse by the financial burden that ADHD can place on families.
Siblings of a child with ADHD also may have a hard time. They can be affected by a sibling who is demanding or aggressive. They also may get less attention because the child with ADHD requires so much of a parent's time.","You're likely to start by taking your child to a pediatrician or family healthcare professional. Depending on the results of the evaluation, your healthcare professional may refer you to a specialist, such as a developmental-behavioral pediatrician, psychologist, psychiatrist or pediatric neurologist.","Because ADHD is complex and each person with ADHD is different, it's hard to make recommendations that work for every child. But some of the following suggestions may help create an environment in which your child can succeed."
