Amyotrophic lateral sclerosis (ALS),https://www.mayoclinic.org/diseases-conditions/amyotrophic-lateral-sclerosis/symptoms-causes/syc-20354022,https://www.mayoclinic.org/diseases-conditions/amyotrophic-lateral-sclerosis/diagnosis-treatment/drc-20354027,https://www.mayoclinic.org/diseases-conditions/amyotrophic-lateral-sclerosis/doctors-departments/ddc-20354029,"Amyotrophic lateral sclerosis (a-my-o-TROE-fik LAT-ur-ul skluh-ROE-sis), known as ALS, is a nervous system disease that affects nerve cells in the brain and spinal cord.ALScauses loss of muscle control. The disease gets worse over time.
ALSis often called Lou Gehrig's disease after the baseball player who was diagnosed with it. The exact cause of the disease is still not known. A small number of cases are inherited.
ALSoften begins with muscle twitching and weakness in an arm or leg, trouble swallowing or slurred speech. EventuallyALSaffects control of the muscles needed to move, speak, eat and breathe. There is no cure for this fatal disease.","Symptoms ofALSvary from person to person. Symptoms depend on which nerve cells are affected.ALSgenerally begins with muscle weakness that spreads and gets worse over time. Symptoms might include:
Trouble walking or doing usual daily activities.
Tripping and falling.
Weakness in the legs, feet or ankles.
Hand weakness or clumsiness.
Slurred speech or trouble swallowing.
Weakness associated with muscle cramps and twitching in the arms, shoulders and tongue.
Untimely crying, laughing or yawning.
Thinking or behavioral changes.
ALSoften starts in the hands, feet, arms or legs. Then it spreads to other parts of the body. Muscles get weaker as more nerve cells die. This eventually affects chewing, swallowing, speaking and breathing.
There's generally no pain in the early stages ofALS. Pain also is not common in the later stages.ALSdoesn't usually affect bladder control. It also usually doesn't affect the senses, including the ability to taste, smell, touch and hear.",,"ALSaffects the nerve cells that control voluntary muscle movements such as walking and talking. These nerve cells are called motor neurons. There are two groups of motor neurons. The first group extends from the brain to the spinal cord to muscles throughout the body. They're referred to as upper motor neurons. The second group extends from the spinal cord to muscles throughout the body. They're referred to as lower motor neurons.
ALScauses both groups of motor neurons to gradually deteriorate and then die. When motor neurons are damaged, they stop sending messages to the muscles. As a result, the muscles can't function.
For about 10% of people withALS, a genetic cause can be identified. For the rest, the cause is not known.
Researchers continue to study possible causes ofALS. Most theories center on a complex interaction between genes and factors in the environment.","Established risk factors forALSinclude:
Genetics.For about 10% of people withALS, a risk gene was passed down from a family member. This is called hereditaryALS. In most people with hereditaryALS, their children have a 50% chance of inheriting the gene.
Age.Risk increases with age up to age 75.ALSis most common between the ages of 60 and the mid-80s.
Sex.Before the age of 65, slightly more men than women developALS. This sex difference disappears after age 70.
Environmental factors, such as the following, have been associated with an increased risk ofALS.
Smoking.Evidence supports that smoking is an environmental risk factor forALS. Women who smoke seem to be at even higher risk, particularly after menopause.
Environmental toxin exposure.Some evidence suggests that exposure to lead or other substances in the workplace or at home might be linked toALS. Much study has been done, but no one agent or chemical has been consistently associated withALS.
Military service.Studies indicate that people who have served in the military are at higher risk ofALS. It's not clear what about military service might triggerALS. It might include exposure to certain metals or chemicals, traumatic injuries, viral infections, or intense exertion.","As the disease progresses,ALScauses complications, such as:",,"Amyotrophic lateral sclerosis, known asALS, can be hard to diagnose early because it can have symptoms similar to other diseases. Tests to rule out other conditions or help diagnoseALSmight include:
Electromyogram (EMG).A needle is inserted through the skin into various muscles. The test records the electrical activity of the muscles when they contract and when they're at rest. This can determine if there is a problem with the muscles or nerves.
Nerve conduction study.This study measures your nerves' ability to send impulses to muscles in different areas of the body. This test can determine if you have nerve damage.EMGand nerve conduction studies are almost always done together.
MRI.Using radio waves and a powerful magnetic field, anMRIproduces detailed images of the brain and spinal cord. AnMRIcan reveal spinal cord tumors, herniated disks in the neck or other conditions that might be causing your symptoms. The highest resolution cameras may sometimes seeALSchanges themselves.
Blood and urine tests.Analyzing samples of your blood and urine in the laboratory might help eliminate other possible causes of your symptoms. Serum neurofilament light levels, which are measured from blood samples, are generally high in people withALS. The test can help make a diagnosis early in the disease.
Spinal tap, known as a lumbar puncture.This involves removing a sample of spinal fluid for laboratory testing. Spinal fluid is removed using a small needle inserted between two bones in the lower back. The spinal fluid appears typical in people withALSbut may uncover another cause of symptoms.
Muscle biopsy.If your health care provider believes you may have a muscle disease rather thanALS, you might undergo a muscle biopsy. While you're under local anesthesia, a small piece of muscle is removed and sent to a lab for analysis.
Nerve biopsy.If your health care provider believes you may have a nerve disease rather thanALS, you might undergo a nerve biopsy. While you're under local anesthesia, a small piece of nerve is removed and sent to a lab for analysis.","Treatments can't reverse the damage ofALS, but they can slow the progression of symptoms. They also can help prevent complications and make you more comfortable and independent.
You might need a team of health care providers and doctors trained in many areas to provide your care. The team works together to prolong your survival and improve your quality of life.
Your team works to select the right treatments for you. You have the right to choose or refuse any of the treatments suggested.","Learning you haveALScan be devastating. The following tips may help you and your family cope:
Take time to grieve.The news that you have a fatal condition that reduces your mobility and independence is hard to hear. You and your family may go through a period of mourning and grief after diagnosis.
Be hopeful.Your team can help you focus on your abilities and healthy living. Some people withALSlive much longer than the 3 to 5 years usually associated with this condition. Some live 10 years or more. Maintaining an optimistic outlook can help improve quality of life for people withALS.
Think beyond the physical changes.Many people withALSlead rewarding lives despite physical limitations. Try to think ofALSas only one part of your life, not your entire identity.
Join a support group.You might find comfort in a support group with others who haveALS. Loved ones helping with your care might benefit from a support group of otherALScaregivers. Find support groups in your area by talking to your doctor or by contacting theALSAssociation.
Make decisions now about your future medical care.Planning for the future allows you to be in control of decisions about your life and your care. It also lessens the burden for your loved ones. With the help of your health care provider, hospice nurse or social worker, you can decide whether you want certain life-extending procedures.You also can decide where you want to spend your final days. You might consider hospice care options. Planning for the future can help you and your loved ones calm anxieties.
Considering getting involved inALSresearch.ALSresearch is working toward finding a cure forALS. Consider joining a clinical trial, providing samples for research and joining the NationalALSRegistry. The registry is open to all people withALS. Many institutions collect samples for research to better understand the disease.","Your primary care provider may be the first to recognize the symptoms ofALS. Your provider will likely refer you to a doctor trained in nervous system conditions, known as a neurologist, to establish a diagnosis.",
Dry socket,https://www.mayoclinic.org/diseases-conditions/dry-socket/symptoms-causes/syc-20354376,https://www.mayoclinic.org/diseases-conditions/dry-socket/diagnosis-treatment/drc-20354382,,"Dry socket is a painful dental condition that sometimes happens after you have a tooth removed. Having a tooth removed is called an extraction. Dry socket happens when a blood clot at the site where the tooth was removed does not form, comes out or dissolves before the wound has healed.
Usually a blood clot forms at the site where a tooth was removed. This blood clot is a protective layer over the underlying bone and nerve endings in the empty tooth socket. Also, the clot contains cells that are needed for proper healing of the site.
Intense pain happens when the underlying bone and nerves are exposed. Pain occurs in the socket and along the nerves to the side of the face. The socket becomes swollen and irritated. It may fill with bits of food, making the pain worse. If you get a dry socket, the pain usually begins 1 to 3 days after the tooth removal.
Dry socket is the most common complication following tooth removals, such as the removal of third molars, also called wisdom teeth. Medicine you can buy without a prescription usually will not be enough to treat dry socket pain. Your dentist or oral surgeon can offer treatments to relieve your pain.","Symptoms of dry socket may include:
Severe pain within a few days after removing a tooth.
Loss of part or all of the blood clot at the tooth removal site. The socket may look empty.
Bone that you can see in the socket.
Pain that spreads from the socket to your ear, eye, temple or neck on the same side of your face as the tooth removal.
Bad breath or a foul odor coming from your mouth.
Bad taste in your mouth.","A certain amount of pain and discomfort is typical after a tooth removal. But you should be able to manage the pain with the pain reliever your dentist or oral surgeon prescribed. The pain should lessen with time.
If you develop new pain or the pain gets worse in the days after your tooth removal, contact your dentist or oral surgeon right away.","The exact cause of dry socket is still being studied. Researchers think that certain issues may be involved, such as:
Bacteria that gets into the socket.
Injury at the surgical site when tooth removal is difficult. This can happen with irregular wisdom tooth development or position, called an impacted wisdom tooth.","Factors that can increase your risk of developing dry socket include:
Smoking and tobacco use.Chemicals in cigarettes or other forms of tobacco may prevent or slow healing. These chemicals can get into the wound site. Also, the act of sucking on a cigarette may cause the blood clot to come out too early.
Birth control pills.High estrogen levels from birth control pills may cause problems with healing and increase the risk of dry socket.
Improper at-home care.Not following home-care instructions and having poor mouth care may increase the risk of dry socket.
Tooth or gum infection.Current or previous infections around the area where the tooth was removed increase the risk of dry socket.","Even though a dry socket can be painful, it rarely causes an infection or serious complications. But healing in the socket may be delayed. Pain may last longer than usual after a tooth removal. Dry socket also may lead to an infection in the socket.",,"Severe pain following tooth removal is often enough for your dentist or oral surgeon to suspect dry socket. You'll likely be asked if you have any other symptoms. Your dentist or oral surgeon can check your mouth to see if you have a blood clot in your tooth socket or if you have lost the clot and have exposed bone.
You may need X-rays of your mouth and teeth to rule out other conditions, such as a bone infection. The X-rays also can show if you have small pieces of tooth root or bone remaining in the site after surgery.","Treatment of dry socket focuses on reducing symptoms, especially pain. Treatment may include:
Flushing out the socket.Your dentist or oral surgeon may flush out the socket to remove any food bits or other loose materials that may add to pain or possible infection.
Dressing with medicine.Your dentist or oral surgeon may pack the socket with medicated gel or paste and a dressing. These can provide quick pain relief. Whether you need dressing changes and how often and whether you need other treatment depends on how severe your pain and other symptoms are.
Pain medicine.Ask which pain medicine is best for you. You'll likely need a prescription pain medicine.
Self-care.Once your dentist or oral surgeon takes out the dressing, you may need to flush the socket at home to keep it clean and improve healing. Your dentist or oral surgeon can give you instructions. You may get a plastic syringe with a curved tip to squirt water, salt water or a prescription rinse into the socket.
Once treatment starts, you may begin to feel some pain relief. Pain and other symptoms should continue to improve and will likely be gone within a few days. Even when you're feeling better, keep scheduled appointments with your dentist or oral surgeon for dressing changes and other care.",,See your dentist or oral surgeon as soon as possible if you have new pain or pain that gets worse after a tooth removal.,"You can help promote healing and reduce symptoms during treatment of dry socket by following instructions for self-care. You'll likely be told to:
Take pain medicines as prescribed.
Do not smoke or use tobacco products.
Drink plenty of clear liquids. This also may prevent nausea caused by some pain medicines.
Rinse your mouth gently with warm salt water several times a day.
Brush your teeth gently around the dry socket area.
Be careful with eating or drinking. To prevent the clot from coming out, avoid carbonated beverages and do not use a straw."
Atypical genitalia,https://www.mayoclinic.org/diseases-conditions/atypical-genitalia/symptoms-causes/syc-20369273,https://www.mayoclinic.org/diseases-conditions/atypical-genitalia/diagnosis-treatment/drc-20369278,,"Atypical genitalia, formerly called ambiguous genitalia, is a rare condition in which an infant's genitals don't appear to be clearly male or female on the outside. In a baby with atypical genitalia, the genitals may not be developed fully or may look different from what is expected. Or the baby may have features of more than one sex. The sex organs on the outside of the body may not match the sex organs on the inside. And they may not match the genetic sex, which is determined by sex chromosomes: typically, XX for females and XY for males.
External genitals are the sex organs on the outside of the body. They include the opening of the vagina and the labia, clitoris, penis and scrotum. Internal genitals are the sex organs inside the body. They include the vagina, fallopian tubes, uterus, prostate, ovaries and testicles. Sex hormones are made by the ovaries and testicles, which also are called gonads. Genetic sex is set based on sex chromosomes. Typically, these sex chromosomes are a genetic female with two X chromosomes and a genetic male with one X and one Y chromosome.
Atypical genitalia is not a disease; it's a difference of sex development. Usually, atypical genitalia can be seen at or shortly after birth. The condition can be very distressing for families. Your medical team looks for the cause of atypical genitalia and provides information and counseling that can help guide decisions about your baby's sex and any needed treatment.","Your medical team will likely be the first to notice atypical genitalia soon after your baby is born. Sometimes, atypical genitalia may be suspected before birth. Atypical genitalia can vary in appearance. Differences may depend on when during genital development the hormone changes that affected development occurred and the cause.
Babies who are genetically female, which means they have two X chromosomes, may have:
An enlarged clitoris, which may look like a penis.
Closed labia, or labia that include folds and look like a scrotum.
Lumps that feel like testicles in the fused labia.
Babies who are genetically male, which means they have one X and one Y chromosome, may have:
A condition in which the narrow tube that carries urine and semen, called the urethra, doesn't fully extend to the tip of the penis. If the tube opening is on the underside of the penis, the condition is called hypospadias.
A very small penis with the urethral opening closer to the scrotum.
One or both testicles missing in what appears to be the scrotum.
Testicles that remain in the body, also called undescended testicles, and an empty scrotum that has the appearance of labia with or without a micropenis.",,Atypical genitalia usually happen when hormone changes during pregnancy stop or disturb an unborn baby's developing sex organs. An unborn baby also is called a fetus.,"Family history may play a role in the development of atypical genitalia. This is because many differences of sex development result from gene changes that can be passed down in families. Possible risk factors for atypical genitalia include a family history of:
Unexplained deaths in early infancy.
Infertility, not having menstrual periods or having a lot of facial hair in females.
Atypical genitalia.
Atypical physical development during puberty.
Congenital adrenal hyperplasia, a group of genetic conditions that affect the adrenal glands and are passed down in families.
If your family has a history of these risk factors, talk with your healthcare professional before trying to get pregnant. Genetic counseling also can help in planning ahead.","Complications of atypical genitalia may include:
Infertility.Whether people with atypical genitalia can have children depends on the specific diagnosis. For example, genetic females with congenital adrenal hyperplasia usually can get pregnant if they so choose.
Higher risk of certain cancers.Some differences of sex development are linked with a higher risk of certain types of cancer.",,"Atypical genitalia is usually diagnosed at birth or shortly after. Sometimes, healthcare professionals may suspect atypical genitalia during pregnancy when results of blood tests of the unborn baby's sex differ from the ultrasound imaging of the baby's genitalia. But generally, the diagnosis is not made until after birth. Healthcare professionals who help with delivery may notice the signs of atypical genitalia in your newborn.","The goal of treatment is long-term mental health and social well-being, as well as having as much sexual function and fertility as possible. When to begin treatment depends on your child's specific situation.
Atypical genitalia is complex and not common. Managing it may require a team of experts. The team might include:
Pediatricians.
Experts in newborns born early or with medical conditions, also called neonatologists.
Experts in children's urinary systems, also called pediatric urologists.
Pediatric general surgeons.
Experts in the body's hormones, also called endocrinologists.
Medical geneticists.
Mental health professionals, such as psychologists or social workers.","If your baby has atypical genitalia, you may worry about the baby's future. Mental health professionals can help you deal with this difference that you didn't expect. Ask your child's healthcare professional for a referral to a mental health professional who has experience helping people in your situation. You also may find it helpful to join a support group, either in person or online.
Your child may find ongoing counseling by mental health professionals helpful and may choose to be a part of support groups into adulthood.
Not knowing the sex of your newborn right away might turn a hoped-for celebration into a stressful time. Your medical team can provide you with updates and information as quickly as possible. They also can answer questions and talk with you about your child's health.
Consider waiting to make a formal announcement of the birth until testing is done and you've created a plan with advice from your medical team. Give yourself some time to learn and think about your child's condition before answering questions from family and friends.","If your baby is born with atypical genitalia, you may be referred to a medical center with doctors and other healthcare professionals who have expertise in managing this condition. Here's some information to help you get ready for your appointment and learn what to expect.",
Lazy eye (amblyopia),https://www.mayoclinic.org/diseases-conditions/lazy-eye/symptoms-causes/syc-20352391,https://www.mayoclinic.org/diseases-conditions/lazy-eye/diagnosis-treatment/drc-20352396,https://www.mayoclinic.org/diseases-conditions/lazy-eye/doctors-departments/ddc-20352397,"Lazy eye (amblyopia) is reduced vision in one eye caused by abnormal visual development early in life. The weaker — or lazy — eye often wanders inward or outward.

Amblyopia generally develops from birth up to age 7 years. It is the leading cause of decreased vision among children. Rarely, lazy eye affects both eyes.

Early diagnosis and treatment can help prevent long-term problems with your child's vision. The eye with poorer vision can usually be corrected with glasses or contact lenses, or patching therapy.","Signs and symptoms of lazy eye include:

Sometimes lazy eye is not evident without an eye exam.","See your child's doctor if you notice his or her eye wandering after the first few weeks of life. A vision check is especially important if there's a family history of crossed eyes, childhood cataracts or other eye conditions.

For all children, a complete eye exam is recommended between ages 3 and 5.","Lazy eye develops because of abnormal visual experience early in life that changes the nerve pathways between a thin layer of tissue (retina) at the back of the eye and the brain. The weaker eye receives fewer visual signals. Eventually, the eyes' ability to work together decreases, and the brain suppresses or ignores input from the weaker eye.

Anything that blurs a child's vision or causes the eyes to cross or turn out can result in lazy eye. Common causes of the condition include:

Difference in sharpness of vision between the eyes (refractive amblyopia).A significant difference between the prescriptions in each eye — often due to farsightedness but sometimes to nearsightedness or an uneven surface curve of the eye (astigmatism) — can result in lazy eye.

Glasses or contact lenses are typically used to correct these refractive problems. In some children lazy eye is caused by a combination of strabismus and refractive problems.",Factors associated with an increased risk of lazy eye include:,"Untreated, lazy eye can cause permanent vision loss.",,"Your doctor will conduct an eye exam, checking for eye health, a wandering eye, a difference in vision between the eyes or poor vision in both eyes. Eyedrops are generally used to dilate the eyes. The eyedrops cause blurred vision that lasts for several hours or a day.

The method used to test vision depends on your child's age and stage of development:","It's important to start treatment for lazy eye as soon as possible in childhood, when the complicated connections between the eye and the brain are forming. The best results occur when treatment starts before age 7, although half of children between the ages of 7 and 17 respond to treatment.

Treatment options depend on the cause of lazy eye and on how much the condition is affecting your child's vision. Your doctor might recommend:

Activity-based treatments — such as drawing, doing puzzles or playing computer games — are available. The effectiveness of adding these activities to other therapies hasn't been proved. Research into new treatments is ongoing.

For most children with lazy eye, proper treatment improves vision within weeks to months. Treatment might last from six months to two years.

It's important for your child to be monitored for recurrence of lazy eye — which can happen in up to 25 percent of children with the condition. If lazy eye recurs, treatment will need to start again.",,"Your child's doctor might refer you to a doctor who specializes in treating eye disorders in children (pediatric ophthalmologist).

Here's some information to help you get ready.",
