Aortic valve regurgitation,https://www.mayoclinic.org/diseases-conditions/aortic-valve-regurgitation/symptoms-causes/syc-20353129,https://www.mayoclinic.org/diseases-conditions/aortic-valve-regurgitation/diagnosis-treatment/drc-20353135,https://www.mayoclinic.org/diseases-conditions/aortic-valve-regurgitation/doctors-departments/ddc-20353137,"Aortic valve regurgitation — also called aortic regurgitation — is a type of heart valve disease. The valve between the lower left heart chamber and the body's main artery doesn't close tightly. As a result, some of the blood pumped out of the heart's main pumping chamber, called the left ventricle, leaks backward.
The leakage may prevent the heart from doing a good enough job of pumping blood to the rest of the body. You may feel tired and short of breath.
Aortic valve regurgitation can develop suddenly or over many years. Once the condition becomes severe, surgery often is needed to repair or replace the valve.","Most often, aortic valve regurgitation develops over time. You may have no symptoms for years. You might not realize that you have the condition. But sometimes, aortic valve regurgitation occurs suddenly. Usually, this is due to an infection of the valve.
As aortic valve regurgitation becomes worse, symptoms may include:
Shortness of breath with exercise or when lying down.
Tiredness and weakness, especially when being more active than usual.
Irregular heartbeat.
Lightheadedness or fainting.
Pain, discomfort or tightness in the chest, which often gets worse during exercise.
Sensations of a rapid, fluttering heartbeat, called palpitations.
Swollen ankles and feet.","Call a member of your health care team right away if you have symptoms of aortic valve regurgitation.
Sometimes the first symptoms of aortic valve regurgitation are related to heart failure. Heart failure is a condition in which the heart can't pump blood as well as it should. Make an appointment with your health care team if you have:
Tiredness, also called fatigue, that doesn't get better with rest.
Shortness of breath.
Swollen ankles and feet.
These are common symptoms of heart failure.","The aortic valve is one of four valves that control blood flow through the heart. It separates the heart's main pumping chamber, called the left ventricle, and the body's main artery, called the aorta. The aortic valve has flaps, also called cusps or leaflets, that open and close once during each heartbeat.
In aortic valve regurgitation, the valve doesn't close properly. This causes blood to leak back into the lower left heart chamber, called the left ventricle. As a result, the chamber holds more blood. This could cause it to get larger and thicken.
At first, the larger left ventricle helps maintain good blood flow with more force. But eventually, the heart becomes weak.
Any condition that damages the aortic valve can cause aortic valve regurgitation. Causes may include:
Heart valve disease present at birth.Some people are born with an aortic valve that has only two cusps, called a bicuspid valve. Others are born with connected cusps rather than the typical three separate ones. Sometimes the valve may have only one cusp, called a unicuspid valve. Other times, there are four cusps, called a quadricuspid valve.Having a parent or sibling with a bicuspid valve raises your risk of the condition. But you can have a bicuspid valve even if you don't have a family history of the condition.
Narrowing of the aortic valve, called aortic stenosis.Calcium deposits can build up on the aortic valve as you age. The buildup causes the aortic valve to stiffen and become narrow. It prevents the valve from opening properly. Aortic stenosis also may prevent the valve from closing properly.
Inflammation of the inner lining of the heart's chambers and valves.This life-threatening condition also is called endocarditis. It's usually caused by an infection. It can damage the aortic valve.
Rheumatic fever.This condition was once a common childhood illness in the United States. Strep throat can cause it. Rheumatic fever can cause the aortic valve to become stiff and narrow, in turn causing blood to leak. If you have an irregular heart valve due to rheumatic fever, it's called rheumatic heart disease.
Other health conditions.Other rare conditions can cause the aorta to get bigger and damage the aortic valve. These include a connective tissue disease called Marfan syndrome. Some immune system conditions, such as lupus, also can lead to aortic valve regurgitation.
Tear or injury of the body's main artery.The body's main artery is the aorta. A traumatic chest injury may damage the aorta and cause aortic regurgitation. So might a tear in the inner layer of the aorta, called an aortic dissection.","Things that raise the risk of aortic valve regurgitation include:
Older age.
Heart problems present at birth, also called congenital heart defects.
History of infections that can affect the heart.
Certain conditions passed down through families that can affect the heart, such as Marfan syndrome.
Other types of heart valve disease, such as aortic valve stenosis.
High blood pressure.
The condition also can happen without any known risk factors.","Complications of aortic valve regurgitation can include:
Fainting or feeling lightheaded.
Heart failure.
Certain heart infections such as endocarditis.
Heart rhythm problems, called arrhythmias.
Death.","If you have any type of heart disease, get regular health checkups.
If you have a parent, child or sibling with a bicuspid aortic valve, you should have an imaging test called an echocardiogram. This can check for aortic valve regurgitation. Early diagnosis of heart valve disease, such as aortic valve regurgitation, is important. Doing so may make the condition easier to treat.
Also, take steps to prevent conditions that can raise the risk of aortic valve regurgitation. For example:
Get a health checkup if you have a severe sore throat.Untreated strep throat can lead to rheumatic fever. Strep throat is treated with medicines that fight bacteria, called antibiotics.
Check your blood pressure regularly.Have your blood pressure checked at least every two years starting at age 18. Some people need more-frequent checks.","To diagnose aortic valve regurgitation, a member of your health care team examines you. You usually are asked questions about your symptoms and health history. You also might be asked about your family's health history.
Your blood pressure is checked using a cuff, usually placed around your arm. A device called a stethoscope is used to listen to your heart. Your health care professional may hear an irregular sound called a heart murmur.
You may be referred to a doctor trained in heart diseases, called a cardiologist.","Treatment of aortic valve regurgitation depends on:
How serious the condition is.
The symptoms, if any.
Whether the condition is getting worse.
The goals of aortic valve regurgitation treatment are to ease symptoms and prevent complications.
If your symptoms are mild or you don't have symptoms, you may only need regular health checkups. You may need regular echocardiograms to check the health of the aortic valve. Heart-healthy lifestyle changes also are usually recommended.",,"If you think you might have symptoms of heart valve disease, make an appointment for a health checkup. You may be referred to a doctor trained in heart diseases. This doctor is called a cardiologist.
If you have aortic valve regurgitation, consider being cared for by a medical team that specializes in heart valve disease.
Here's some information to help you prepare for your appointment.","While lifestyle changes can't prevent or treat your condition, your health care team might suggest that you practice some heart-healthy habits. These may include:
Eat a heart-healthy diet.Enjoy a variety of fruits and vegetables, low-fat or fat-free dairy products, poultry, fish, and whole grains. Stay away from saturated and trans fats and excess salt and sugar.
Stay at a healthy weight.Aim to keep a healthy weight. If you're overweight or obese, your health care team may recommend that you lose weight. Ask what goal weight is healthy for you.
Get regular exercise.Aim to include about 30 minutes of physical activity, such as brisk walks, into your daily fitness routine. Ask your care team for advice before you start to exercise, especially if you're thinking about playing competitive sports.
Don't smoke or use tobacco.If you smoke, quit. Ask your care team about resources to help you quit smoking. Joining a support group may be helpful.
Control high blood pressure.Uncontrolled high blood pressure increases the risk of serious health problems. Get your blood pressure checked at least every two years if you're 18 or older. If you have risk factors for heart disease or are over age 40, you may need more-frequent checks.
Get a cholesterol test.Get your first cholesterol test when you're in your 20s and then another at least every 4 to 6 years. Some people may need to start testing earlier or have more-frequent checks.
Manage diabetes.If you have diabetes, tight blood sugar control can help keep your heart healthy.
Practice good sleep habits.Poor sleep may increase the risk of heart disease. Adults should aim to get 7 to 9 hours of sleep daily. Go to bed and wake at the same time every day, including on weekends. If you have trouble sleeping, talk with your health care team about strategies that might help."
Auditory processing disorder,https://www.mayoclinic.org/diseases-conditions/auditory-processing-disorder/symptoms-causes/syc-20555261,https://www.mayoclinic.org/diseases-conditions/auditory-processing-disorder/diagnosis-treatment/drc-20555277,https://www.mayoclinic.org/diseases-conditions/auditory-processing-disorder/doctors-departments/ddc-20555296,"Auditory processing disorder, also called APD, is a type of hearing loss caused by something affecting the part of the brain that processes how you hear. Ear damage causes other types of hearing loss.
APDis also sometimes called central auditory processing disorder (CAPD). It can happen in anyone. But it most often happens in children and older adults.
Many conditions can affect how well a person understands what they hear, such as attention-deficit/hyperactivity disorder (ADHD) or autism. But these conditions are different from auditory processing disorder, although they can appear withAPD.APDalso can happen with other types of hearing loss.
Auditory processing disorder has no cure. But treatments can help you hear better.","Symptoms of auditory processing disorder (APD) can be subtle. Symptoms can include having trouble with:
Telling where sound is coming from.
Understanding words that are spoken quickly or in a noisy room.
Paying attention.
Reading and spelling.
Following directions unless they are short and simple.
Learning a new language.
Singing or enjoying music.
Understanding and remembering spoken information.
If you haveAPD, you also might:
Take longer to reply to someone who is talking to you.
Often need others to repeat themselves.
Not understand sarcasm or jokes.
APDis often seen with attention, language and learning issues like those seen in attention-deficit/hyperactivity disorder, or ADHD.","If you have trouble hearing or understanding what you hear, talk to a health care professional.","The cause of auditory processing disorder (APD) is sometimes unknown.APDcan be linked to many conditions. In older adults, conditions might include stroke and head trauma. In children,APDcan be linked to issues at birth, such as low birth weight or early birth, or repeated ear infections.
In typical hearing, the brain's auditory center takes the sound waves sent from the ears and turns them into sounds you know. But with auditory processing disorder (APD), the auditory part of the brain can't do this.","Factors that increase your risk of auditory processing disorder (APD) include:
Aging.
Stroke.
Head trauma.
Lead poisoning.
Seizure disorders.
Issues linked to birth, such as an early birth, low birth weight or a pregnant person using alcohol, drugs or tobacco.
Repeated ear infections, especially at a young age.","Auditory processing disorder (APD) complications include:
Trouble understanding what people are saying.
Trouble taking part in activities.
Feeling isolated and lonely.
Trouble reading and writing, in children.
Trouble doing well in school.
Feeling depressed.",,"To diagnose auditory processing disorder (APD), your health care team may ask questions about your symptoms and how long you have had them, as well as order tests.
Several specialists on your health care team might help diagnose you or your child with auditory processing disorder (APD). For children, the team might include teachers, who look at learning and attention issues. For children and adults, the team might include mental health professionals, called psychologists, who look at how the mind works. And speech-language pathologists can look at the use of language.
A hearing specialist called an audiologist may do tests to see what is happening when you or your child hear sounds. These tests might include:
Tympanometry.This test can tell if the eardrum isn't moving well. The eardrum needs to move for good hearing. For this test, the audiologist places a soft probe in the ear canal. Then they send small bits of air pressure toward the ear. The probe measures how much the eardrum moves in response to the air.
Acoustic reflex test.This test shows what happens in the ear when it hears a loud sound.
Auditory brainstem response.This test shows how well the inner ear, called the cochlea, and the brain pathways for hearing are working. An audiologist places sensors around the ear and on the head. The sensors connect to a computer.Short clicking sounds come through headphones worn during the test. The computer records how the nerves between the ears and the brain respond to the sounds.
Evoked potential test.This test shows how well sound travels along the nerves that connect the ears to the brain. For this test, an audiologist places sensors on the head. The sensors connect to a computer. Short clicking sounds come through headphones worn during the test.This lets an audiologist see how well sound gets to different parts of the brain. It also shows if anything is blocking the nerves that link the ears to the brain.","Not everyone with auditory processing disorder (APD) needs treatment. If you or your child need treatment, there are many approaches. Every person withAPDhas different needs. Your health care team can work with you to help you. Your or your child's treatment might include:
Hearing aids and listening devices.Your health care team may suggest that you use hearing aids with wireless listening devices. Listening devices help direct sound to you. They get sound from the source to your hearing aid.Frequency modulated, or FM, systems send sounds to you so you can hear them better. They work with a hearing aid and direct sounds to it. These systems help make it easier to hear sounds in noisy environments.
Auditory training.Auditory training,also called hearing rehabilitation, helps you adjust to hearing loss. You may train with an audiologist, a speech-language pathologist or both. You may train one-on-one with a therapist or as part of a group.During auditory training, you learn to tell one type of sound from another. You do this by listening to sounds that are louder and softer, given quickly and slowly. Sounds come from different directions. You also learn to tell the difference between speech sounds, which affects the meaning of the words you hear.Auditory training helps the brain tell the difference between the many sounds you hear every day. The goal is to help you feel like you're able to talk with others more.
Computer-based training.Computer-based programs can help train the brain to recognize and understand sounds. These programs are like auditory training, but you do them online or with a computer program.","Having auditory processing disorder (APD) can make you feel left out of everyday events. It can make you feel lonely. Auditory training as part of your treatment may help you or your child learn how to cope with hearing loss and adjust to it.
Auditory training might help you or your child learn to talk to others better and help them talk to you. This can help you feel less alone and more connected to others.","You or your child might start by seeing your family health care professional. For testing, you or your child might be referred to a specialist in hearing, called an audiologist.
Here's some information to help you get ready for your appointment.","There are simple steps you can take to manage auditory processing disorder (APD). For instance:
Try using a remote microphone to improve how well you can hear in a noisy room.
Move closer to the person who is speaking.
Think about covering surfaces that make sounds echo, such as open or empty spaces.
Move away from other sources of noise, such as a fan.
In a class or at a meeting, ask someone to take notes for you or get a written copy of what was said.
Ask for anything important to be in writing.
Use subtitles when watching TV."
Primary progressive aphasia,https://www.mayoclinic.org/diseases-conditions/primary-progressive-aphasia/symptoms-causes/syc-20350499,https://www.mayoclinic.org/diseases-conditions/primary-progressive-aphasia/diagnosis-treatment/drc-20350504,https://www.mayoclinic.org/diseases-conditions/primary-progressive-aphasia/doctors-departments/ddc-20350506,"Primary progressive aphasia (uh-FAY-zhuh) is a rare nervous system condition that affects a person's ability to communicate. People who have primary progressive aphasia can have trouble expressing their thoughts and understanding or finding words.
Symptoms develop gradually, often before age 65. They get worse over time. People with primary progressive aphasia can lose the ability to speak and write. Eventually they're not able to understand written or spoken language.
This condition progresses slowly. People who have primary progressive aphasia may continue caring for themselves and participating in daily activities for several years.
Primary progressive aphasia is a type of frontotemporal dementia. Frontotemporal dementia is a cluster of conditions that result from the degeneration of the frontal or temporal lobes of the brain. These areas include brain tissue involved in speech and language. Not all people with primary progressive aphasia have dementia, but most develop it. The term ""dementia"" is typically not used until a person can't do things alone due to changes in their thinking and understanding.",Primary progressive aphasia symptoms vary based on which part of the brain's language areas are involved. The condition has three types. Each type causes different symptoms. Symptoms develop over time and gradually get worse.,"See your healthcare professional if you have concerns about your ability to communicate. If you have a family member or friend who has symptoms of primary progressive aphasia, talk to the person about your concerns. Offer to go with the person to see a healthcare professional.
If changes in speech or communication come on suddenly, call 911 or your local emergency number.","Primary progressive aphasia is caused by a shrinking of certain areas of the brain, known as lobes. In primary progressive aphasia, the frontal, temporal or parietal lobes are affected. When areas of the brain shrink, it's called atrophy. The atrophy caused by primary progressive aphasia mainly happens on the left side of the brain. The areas affected are responsible for speech and language.
Atrophy is linked to the presence of certain proteins in the brain. The proteins may reduce brain activity or function.","Risk factors for primary progressive aphasia include:
Learning disabilities.People who had a childhood learning disability such as dyslexia may have a higher risk of developing primary progressive aphasia.
Certain gene changes.Although primary progressive aphasia most often happens randomly, rare gene changes have been linked to the condition. If other members of your family have had primary progressive aphasia, consider genetic testing to see if you are more likely to develop it.","People with primary progressive aphasia eventually lose the ability to speak and write. This may take anywhere from 3 to 15 years. People with the condition also have trouble understanding written and spoken language.
As the disease progresses, other mental skills such as memory, planning and organizing can be affected. Some people develop other symptoms such as problems with movement, balance and swallowing. With these complications, people with the disease eventually need help with day-to-day care.
People with primary progressive aphasia also can develop depression as the disease progresses. Other complications might include blunted emotions such as not showing concern, poor judgment or social behavior that's not appropriate.","There is no known way to prevent primary progressive aphasia. However, you can keep your brain healthy by using GROWTH:
Get quality sleep.
Reduce stress.
Open connections.
Work out.
Try new things.
Healthy eating.","To diagnose primary progressive aphasia, a neurologist or speech and language pathologist will likely review your symptoms and order tests.
Communication troubles that get worse without significant changes in thinking and behavior for 2 to 3 years are a hallmark of primary progressive aphasia.
Tests and procedures used to diagnose primary progressive aphasia may include:","Primary progressive aphasia can't be cured, and there are no medicines to treat it. However, some therapies might help improve or maintain your ability to communicate and manage your condition.","Losing the ability to communicate can be stressful and frustrating. This is true for both the person with primary progressive aphasia and for friends and family. If you're a caregiver of someone with primary progressive aphasia, taking these steps can help everyone cope:
Learn all you can about the condition.
Have the person with the condition carry an identification card and other materials that can help explain the condition to others.
Give the person time to talk.
Speak slowly in simple, adult sentences and listen carefully.
Talk with the person with the condition about how you can help.
Take care of your personal needs. Get enough rest and make time for social activities.
Family members eventually may need to make long-term care choices for the person with primary progressive aphasia. They also may need to plan the person's finances and help make legal decisions to prepare for more-serious stages of the condition. Start this process early so the person with primary progressive aphasia can be involved.
Support groups may be offered for caregivers and people with primary progressive aphasia or related conditions. Ask your social worker or other members of your healthcare team about community resources or support groups. Other sources of information include the National Aphasia Association and the Association for Frontotemporal Degeneration.","If you're experiencing symptoms, you might start by seeing your primary healthcare professional. This person may refer you to a doctor trained in brain and nervous system conditions, known as a neurologist. You also may be referred to a speech-language pathologist.",
