disease,main_link,Diagnosis_treatment_link,Doctors_departments_link,Overview,Symptoms,When to see a doctor,Causes,Risk factors,Complications,Prevention,Diagnosis,Treatment,Coping and support,Preparing for your appointment,Lifestyle and home remedies
Atrial fibrillation,https://www.mayoclinic.org/diseases-conditions/atrial-fibrillation/symptoms-causes/syc-20350624,https://www.mayoclinic.org/diseases-conditions/atrial-fibrillation/diagnosis-treatment/drc-20350630,https://www.mayoclinic.org/diseases-conditions/atrial-fibrillation/doctors-departments/ddc-20350632,"Atrial fibrillation (AFib) is an irregular and often very rapid heart rhythm. An irregular heart rhythm is called an arrhythmia.AFibcan lead to blood clots in the heart. The condition also increases the risk of stroke, heart failure and other heart-related complications.
During atrial fibrillation, the heart's upper chambers — called the atria — beat chaotically and irregularly. They beat out of sync with the lower heart chambers, called the ventricles. For many people,AFibmay have no symptoms. ButAFibmay cause a fast, pounding heartbeat, shortness of breath or light-headedness.
Episodes of atrial fibrillation may come and go, or they may be persistent.AFibitself usually isn't life-threatening. But it's a serious medical condition that needs proper treatment to prevent stroke.
Treatment for atrial fibrillation may include medicines, therapy to shock the heart back to a regular rhythm and procedures to block faulty heart signals.
A person with atrial fibrillation also may have a related heart rhythm problem called atrial flutter. The treatments forAFiband atrial flutter are similar.","Symptoms ofAFibmay include:
Feelings of a fast, fluttering or pounding heartbeat, called palpitations.
Chest pain.
Dizziness.
Fatigue.
Lightheadedness.
Reduced ability to exercise.
Shortness of breath.
Weakness.
Some people with atrial fibrillation (AFib) don't notice any symptoms.
Atrial fibrillation may be:
Occasional, also called paroxysmal atrial fibrillation.AFibsymptoms come and go. The symptoms usually last for a few minutes to hours. Some people have symptoms for as long as a week. The episodes can happen repeatedly. Symptoms might go away on their own. Some people with occasionalAFibneed treatment.
Persistent.The irregular heartbeat is constant. The heart rhythm does not reset on its own. If symptoms occur, medical treatment is needed to correct the heart rhythm.
Long-standing persistent.This type ofAFibis constant and lasts longer than 12 months. Medicines or a procedure are needed to correct the irregular heartbeat.
Permanent.In this type of atrial fibrillation, the irregular heart rhythm can't be reset. Medicines are needed to control the heart rate and to prevent blood clots.","If you have symptoms of atrial fibrillation, make an appointment for a health checkup. You may be referred to a doctor trained in heart diseases, called a cardiologist.
If you have chest pain, seek immediate medical help. Chest pain could mean that you're having a heart attack.","To understand the causes of atrial fibrillation (AFib), it may be helpful to know how the heart typically beats.
The heart has four chambers:
The two upper chambers are called the atria.
The two lower chambers are called the ventricles.
Inside the upper right heart chamber is a group of cells called the sinus node. The sinus node makes the signals that starts each heartbeat.
The signals move across the upper heart chambers. Next, the signals arrive at a group of cells called theAVnode, where they usually slow down. The signals then go to the lower heart chambers.
In a healthy heart, this signaling process usually goes smoothly. The resting heart rate is typically 60 to 100 beats a minute.
But in atrial fibrillation, the signals in the upper chambers of the heart are chaotic. As a result, the upper chambers tremble or shake. TheAVnode is flooded with signals trying to get through to the lower heart chambers. This causes a fast and irregular heart rhythm.
In people withAFib, the heart rate may range from 100 to 175 beats a minute.","Things that can increase the risk of atrial fibrillation (AFib) include:
Age.The risk ofAFibincreases as you grow older.
Caffeine, nicotine or illegal drug use.Caffeine, nicotine and some illegal drugs — such as amphetamines and cocaine — can cause your heart to beat faster. Use of these substances may lead to the development of more-serious arrhythmias.
Drinking too much alcohol.Drinking too much alcohol can affect the electrical signals in the heart. This can increase the risk of atrial fibrillation.
Changes in the level of body minerals.Minerals in the blood called electrolytes — such as potassium, sodium, calcium and magnesium — help the heart beat. If these substances are too low or too high, irregular heartbeats may occur.
Family history.An increased risk of atrial fibrillation occurs in some families.
Heart problems or heart surgery.Coronary artery disease, heart valve disease and heart problems present at birth increase the risk ofAFib. A history of heart attack or heart surgery also makes a person more likely to get the condition.
High blood pressure.Having high blood pressure increases the risk of getting coronary artery disease. Over time, high blood pressure may cause part of the heart to become stiff and thick. This can change how heartbeat signals travel through the heart.
Obesity.People who have obesity are at higher risk of developing atrial fibrillation.
Other long-term health conditions.You may be more likely to getAFibif you have diabetes, chronic kidney disease, lung disease or sleep apnea.
Some medicines and supplements.Some prescription medicines and certain cough and cold remedies bought without a prescription can cause irregular heartbeats.
Thyroid disease.Having an overactive thyroid gland can raise the risk of irregular heartbeats.","Blood clots are a dangerous complication of atrial fibrillation (AFib). Blood clots can lead to stroke.
The risk of stroke fromAFibincreases as you grow older. Other health conditions also may increase the risk of a stroke due toAFib. These conditions include:
High blood pressure.
Diabetes.
Heart failure.
Some types of heart valve disease.
Blood thinners are commonly prescribed to prevent blood clots and strokes in people with atrial fibrillation.","Healthy lifestyle choices can reduce the risk of heart disease and may prevent atrial fibrillation (AFib). Here are some basic heart-healthy tips:
Control high blood pressure, high cholesterol and diabetes.
Don't smoke or use tobacco.
Eat a diet that's low in salt and saturated fat.
Exercise at least 30 minutes a day on most days of the week unless your health care team says not to.
Get good sleep. Adults should aim for 7 to 9 hours daily.
Maintain a healthy weight.
Reduce and manage stress.","You may not know you have atrial fibrillation (AFib). The condition may be found when a health checkup is done for another reason.
To diagnoseAFib, the health care provider examines you and asks questions about your medical history and symptoms. Tests may be done to look for conditions that can cause irregular heartbeats, such as heart disease or thyroid disease.","The goals of atrial fibrillation treatment are to reset and control the heartbeat and prevent blood clots.
Treatment depends on:
How long you've hadAFib.
Your symptoms.
The cause of the irregular heartbeat.
Atrial fibrillation treatment may involve:
Medicine.
Therapy to reset the heart rhythm, called cardioversion.
Surgery or catheter procedures.
Together, you and your health care team discuss the best treatment option for you. It's important to follow your atrial fibrillation treatment plan. IfAFibisn't well controlled, it may lead to other complications, including stroke and heart failure.",,"If you have an irregular or pounding heartbeat, make an appointment for a health checkup. IfAFibis found early, treatment may be easier, and it may work better. You may be referred to a doctor trained in heart diseases. This type of provider is called a cardiologist.
Here's some information to help you prepare for your appointment.","Following a heart-healthy lifestyle can help prevent or treat conditions that can lead to atrial fibrillation (AFib). The following changes are recommended to improve heart health:
Eat healthy foods.Choose plenty of fruits, vegetables and whole grains. Limit sugar, salt and saturated fats.
Exercise and stay active.Regular physical activity helps control diabetes, high cholesterol and high blood pressure — all risk factors for heart disease. Try to get 30 to 60 minutes of physical activity most days of the week. Talk to your health care team about the amount and type of exercise that's best for you.
Don't smoke.Smoking is a major risk factor for heart disease. If you need help quitting, talk to your health care team.
Maintain a healthy weight.Being overweight increases the risk of heart disease. Talk with your care provider to set realistic goals for weight.
Control blood pressure.Get your blood pressure checked at least every two years if you're 18 and older. If you have risk factors for heart disease or are over age 40, you may need more-frequent checks. If you have high blood pressure, follow your treatment plan as directed.
Get your cholesterol checked.Ask your health care team how often you need a cholesterol test. Lifestyle changes and medicines may be recommended to control high cholesterol.
Limit alcohol.Binge drinking (having five drinks in two hours for men or four drinks for women) can increase the risk of atrial fibrillation. In some people, even lower amounts of alcohol can triggerAFib.
Practice good sleep habits.Poor sleep may increase the risk of heart disease and other chronic conditions. Adults should aim to get 7 to 9 hours of sleep daily.
It's also important to have regular health checkups. Tell your health care team if yourAFibsymptoms get worse."
Hyperhidrosis,https://www.mayoclinic.org/diseases-conditions/hyperhidrosis/symptoms-causes/syc-20367152,https://www.mayoclinic.org/diseases-conditions/hyperhidrosis/diagnosis-treatment/drc-20367173,https://www.mayoclinic.org/diseases-conditions/hyperhidrosis/doctors-departments/ddc-20367288,"Hyperhidrosis (hi-pur-hi-DROE-sis) is excessive sweating that's not always related to heat or exercise. You may sweat so much that it soaks through your clothes or drips off your hands. Heavy sweating can disrupt your day and cause social anxiety and embarrassment.
Hyperhidrosis treatment usually helps. It often begins with antiperspirants. If these don't help, you may need to try different medications and therapies. In severe cases, your health care provider may suggest surgery to remove the sweat glands or to disconnect the nerves related to producing too much sweat.
Sometimes an underlying condition may be found and treated.","The main symptom of hyperhidrosis is heavy sweating. This goes beyond the sweating from being in a hot environment, exercising, or feeling anxious or stressed. The type of hyperhidrosis that usually affects the hands, feet, underarms or face causes at least one episode a week when you're awake. And the sweating usually happens on both sides of the body.","Sometimes excessive sweating is a sign of a serious condition.
Seek immediate medical attentionif you have heavy sweating with dizziness, pain in the chest, throat, jaw, arms, shoulders or throat, or cold skin and a rapid pulse.
See your health care provider if:
Sweating disrupts your daily routine
Sweating causes emotional distress or social withdrawal
You suddenly begin to sweat more than usual
You experience night sweats for no apparent reason","Sweating is the body's mechanism to cool itself. The nervous system automatically triggers sweat glands when your body temperature rises. Sweating also occurs, especially on your palms, when you're nervous.
Primary hyperhidrosis is caused by faulty nerve signals that trigger eccrine sweat glands to become overactive. It usually affects the palms, soles, underarms and sometimes the face.
There is no medical cause for this type of hyperhidrosis. It can run in families.
Secondary hyperhidrosis is caused by an underlying medical condition or by taking certain medications, such as pain relievers, antidepressants, and some diabetes and hormonal medications. This type of hyperhidrosis may cause sweating all over the body. Conditions that might cause it include:
Diabetes
Menopause hot flashes
Thyroid problems
Some types of cancer
Nervous system disorders
Infections","Risk factors for hyperhidrosis include:
Having a blood relative, such as a parent, sibling or grandparent, who sweats heavily
Taking medicines or supplements that cause sweating
Having a medical condition that causes sweating","Complications of hyperhidrosis include:
Infections.People who sweat a lot are more prone to skin infections.
Social and emotional effects.Having clammy or dripping hands and sweat-soaked clothes can be embarrassing. Your condition may affect your pursuit of work and educational goals.",,Diagnosing hyperhidrosis may start with your health care provider asking about your medical history and symptoms. You may also need a physical exam or tests to further evaluate the cause of your symptoms.,"Treating hyperhidrosis may start with treating the condition causing it. If a cause isn't found, treatment focuses on controlling heavy sweating. If new self-care habits don't improve your symptoms, your health care provider may suggest one or more of the following treatments. Even if your sweating improves after treatment, it may recur.","Hyperhidrosis can be the cause of discomfort and embarrassment. You may have trouble working or enjoying recreational activities because of wet hands or feet or wet stains on clothing. You might feel anxious about your symptoms and become withdrawn or self-conscious. You may be frustrated or upset by other people's reactions.
Talk about your concerns with your health care provider, a counselor or a medical social worker. Or you may find it helpful to talk with other people who have hyperhidrosis.","You may start by seeing your primary care provider. You may then be referred to a specialist in diagnosing and treating conditions of the hair and skin (dermatologist). If your condition is not responding to treatment, you may be referred to a specialist in the nervous system (neurologist) or a surgeon.
Here's some information to help you get ready for your appointment.","The following suggestions may help control sweating and body odor:
Use antiperspirant.Antiperspirants containing 6% to 20% aluminum chloride (Drysol, Xerac AC, others) can temporarily block sweat pores. This reduces the amount of sweat that reaches the skin. This type of product may help with minor hyperhidrosis. Apply it to dry skin before going to bed and wash it off when you wake.
Choose shoes and socks made of natural materials.Shoes made of natural materials, such as leather, allow your feet to breath, which helps prevent sweaty feet. Wear moisture-wicking athletic socks when you're active. In the store, you can tell which socks are moisture wicking by reading the packaging.
Keep your feet dry.Change socks or hose one or two times a day. Dry your feet each time. If you wear pantyhose, try the type with cotton soles. Use shoe insoles and foot powder to help absorb sweat. Wear sandals or go barefoot when you can. Or at least slip out of your shoes now and then.
Choose clothing to suit your activity.When you can, wear natural fabrics, such as cotton, wool and silk. These allow your skin to breathe. When you're very active, you might prefer fabrics designed to wick moisture away from your skin."
Atrial fibrillation,https://www.mayoclinic.org/diseases-conditions/atrial-fibrillation/symptoms-causes/syc-20350624,https://www.mayoclinic.org/diseases-conditions/atrial-fibrillation/diagnosis-treatment/drc-20350630,https://www.mayoclinic.org/diseases-conditions/atrial-fibrillation/doctors-departments/ddc-20350632,"Atrial fibrillation (AFib) is an irregular and often very rapid heart rhythm. An irregular heart rhythm is called an arrhythmia.AFibcan lead to blood clots in the heart. The condition also increases the risk of stroke, heart failure and other heart-related complications.
During atrial fibrillation, the heart's upper chambers — called the atria — beat chaotically and irregularly. They beat out of sync with the lower heart chambers, called the ventricles. For many people,AFibmay have no symptoms. ButAFibmay cause a fast, pounding heartbeat, shortness of breath or light-headedness.
Episodes of atrial fibrillation may come and go, or they may be persistent.AFibitself usually isn't life-threatening. But it's a serious medical condition that needs proper treatment to prevent stroke.
Treatment for atrial fibrillation may include medicines, therapy to shock the heart back to a regular rhythm and procedures to block faulty heart signals.
A person with atrial fibrillation also may have a related heart rhythm problem called atrial flutter. The treatments forAFiband atrial flutter are similar.","Symptoms ofAFibmay include:
Feelings of a fast, fluttering or pounding heartbeat, called palpitations.
Chest pain.
Dizziness.
Fatigue.
Lightheadedness.
Reduced ability to exercise.
Shortness of breath.
Weakness.
Some people with atrial fibrillation (AFib) don't notice any symptoms.
Atrial fibrillation may be:
Occasional, also called paroxysmal atrial fibrillation.AFibsymptoms come and go. The symptoms usually last for a few minutes to hours. Some people have symptoms for as long as a week. The episodes can happen repeatedly. Symptoms might go away on their own. Some people with occasionalAFibneed treatment.
Persistent.The irregular heartbeat is constant. The heart rhythm does not reset on its own. If symptoms occur, medical treatment is needed to correct the heart rhythm.
Long-standing persistent.This type ofAFibis constant and lasts longer than 12 months. Medicines or a procedure are needed to correct the irregular heartbeat.
Permanent.In this type of atrial fibrillation, the irregular heart rhythm can't be reset. Medicines are needed to control the heart rate and to prevent blood clots.","If you have symptoms of atrial fibrillation, make an appointment for a health checkup. You may be referred to a doctor trained in heart diseases, called a cardiologist.
If you have chest pain, seek immediate medical help. Chest pain could mean that you're having a heart attack.","To understand the causes of atrial fibrillation (AFib), it may be helpful to know how the heart typically beats.
The heart has four chambers:
The two upper chambers are called the atria.
The two lower chambers are called the ventricles.
Inside the upper right heart chamber is a group of cells called the sinus node. The sinus node makes the signals that starts each heartbeat.
The signals move across the upper heart chambers. Next, the signals arrive at a group of cells called theAVnode, where they usually slow down. The signals then go to the lower heart chambers.
In a healthy heart, this signaling process usually goes smoothly. The resting heart rate is typically 60 to 100 beats a minute.
But in atrial fibrillation, the signals in the upper chambers of the heart are chaotic. As a result, the upper chambers tremble or shake. TheAVnode is flooded with signals trying to get through to the lower heart chambers. This causes a fast and irregular heart rhythm.
In people withAFib, the heart rate may range from 100 to 175 beats a minute.","Things that can increase the risk of atrial fibrillation (AFib) include:
Age.The risk ofAFibincreases as you grow older.
Caffeine, nicotine or illegal drug use.Caffeine, nicotine and some illegal drugs — such as amphetamines and cocaine — can cause your heart to beat faster. Use of these substances may lead to the development of more-serious arrhythmias.
Drinking too much alcohol.Drinking too much alcohol can affect the electrical signals in the heart. This can increase the risk of atrial fibrillation.
Changes in the level of body minerals.Minerals in the blood called electrolytes — such as potassium, sodium, calcium and magnesium — help the heart beat. If these substances are too low or too high, irregular heartbeats may occur.
Family history.An increased risk of atrial fibrillation occurs in some families.
Heart problems or heart surgery.Coronary artery disease, heart valve disease and heart problems present at birth increase the risk ofAFib. A history of heart attack or heart surgery also makes a person more likely to get the condition.
High blood pressure.Having high blood pressure increases the risk of getting coronary artery disease. Over time, high blood pressure may cause part of the heart to become stiff and thick. This can change how heartbeat signals travel through the heart.
Obesity.People who have obesity are at higher risk of developing atrial fibrillation.
Other long-term health conditions.You may be more likely to getAFibif you have diabetes, chronic kidney disease, lung disease or sleep apnea.
Some medicines and supplements.Some prescription medicines and certain cough and cold remedies bought without a prescription can cause irregular heartbeats.
Thyroid disease.Having an overactive thyroid gland can raise the risk of irregular heartbeats.","Blood clots are a dangerous complication of atrial fibrillation (AFib). Blood clots can lead to stroke.
The risk of stroke fromAFibincreases as you grow older. Other health conditions also may increase the risk of a stroke due toAFib. These conditions include:
High blood pressure.
Diabetes.
Heart failure.
Some types of heart valve disease.
Blood thinners are commonly prescribed to prevent blood clots and strokes in people with atrial fibrillation.","Healthy lifestyle choices can reduce the risk of heart disease and may prevent atrial fibrillation (AFib). Here are some basic heart-healthy tips:
Control high blood pressure, high cholesterol and diabetes.
Don't smoke or use tobacco.
Eat a diet that's low in salt and saturated fat.
Exercise at least 30 minutes a day on most days of the week unless your health care team says not to.
Get good sleep. Adults should aim for 7 to 9 hours daily.
Maintain a healthy weight.
Reduce and manage stress.","You may not know you have atrial fibrillation (AFib). The condition may be found when a health checkup is done for another reason.
To diagnoseAFib, the health care provider examines you and asks questions about your medical history and symptoms. Tests may be done to look for conditions that can cause irregular heartbeats, such as heart disease or thyroid disease.","The goals of atrial fibrillation treatment are to reset and control the heartbeat and prevent blood clots.
Treatment depends on:
How long you've hadAFib.
Your symptoms.
The cause of the irregular heartbeat.
Atrial fibrillation treatment may involve:
Medicine.
Therapy to reset the heart rhythm, called cardioversion.
Surgery or catheter procedures.
Together, you and your health care team discuss the best treatment option for you. It's important to follow your atrial fibrillation treatment plan. IfAFibisn't well controlled, it may lead to other complications, including stroke and heart failure.",,"If you have an irregular or pounding heartbeat, make an appointment for a health checkup. IfAFibis found early, treatment may be easier, and it may work better. You may be referred to a doctor trained in heart diseases. This type of provider is called a cardiologist.
Here's some information to help you prepare for your appointment.","Following a heart-healthy lifestyle can help prevent or treat conditions that can lead to atrial fibrillation (AFib). The following changes are recommended to improve heart health:
Eat healthy foods.Choose plenty of fruits, vegetables and whole grains. Limit sugar, salt and saturated fats.
Exercise and stay active.Regular physical activity helps control diabetes, high cholesterol and high blood pressure — all risk factors for heart disease. Try to get 30 to 60 minutes of physical activity most days of the week. Talk to your health care team about the amount and type of exercise that's best for you.
Don't smoke.Smoking is a major risk factor for heart disease. If you need help quitting, talk to your health care team.
Maintain a healthy weight.Being overweight increases the risk of heart disease. Talk with your care provider to set realistic goals for weight.
Control blood pressure.Get your blood pressure checked at least every two years if you're 18 and older. If you have risk factors for heart disease or are over age 40, you may need more-frequent checks. If you have high blood pressure, follow your treatment plan as directed.
Get your cholesterol checked.Ask your health care team how often you need a cholesterol test. Lifestyle changes and medicines may be recommended to control high cholesterol.
Limit alcohol.Binge drinking (having five drinks in two hours for men or four drinks for women) can increase the risk of atrial fibrillation. In some people, even lower amounts of alcohol can triggerAFib.
Practice good sleep habits.Poor sleep may increase the risk of heart disease and other chronic conditions. Adults should aim to get 7 to 9 hours of sleep daily.
It's also important to have regular health checkups. Tell your health care team if yourAFibsymptoms get worse."
